name,slug,category,brand,description,listPrice,price,countInStock,images,tags,isPublished,sku,specifications,dimensions,weight,material,finish,energyRating,energyConsumption,capacity,warrantyDetails,installationRequired,modelNumber
westpoint WLX2021P Top Load Washer 20KG,westpoint-wlx2021p,Washers,westpoint,"westpoint WLX2021P is a heavy-duty 20 kg top-load fully automatic washing machine.  It includes multiple wash cycles and LED display, designed for large loads. (White finish.)",2894.2,2894.2,65,,"laundry,washer",Yes,10-WEST-WLX-2021.P,"Capacity: 20 kg  
Drum Material: Stainless steel  
Wash Programs: Heavy, Normal, Delicate, Quick, Eco  
Control Panel: LED display with touchpad and rotary selectors  
Motor Type: Direct drive inverter motor  ", 104 × 65 × 67 cm   ,80 kg  ,Metal,White, 3-star (ESMA)  ,1.2 kWh per cycle (standard 60 °C wash)  ,20 kg,"Coverage Period: 3 months | What’s Covered: Complete electronic unit | Exclusions: Physical damage by consumer, unless otherwise specified",Yes,WLX-2021.P
westpoint WLX1517P Top Load Washer 15KG,westpoint-wlx1517p,Washers,westpoint,westpoint WLX1517P offers a 15 kg capacity with 9 wash programs (including quick wash and delay start) and LED display:contentReference[oaicite:17]{index=17}.  It carries a 3-star ESMA energy rating and features a durable stainless steel drum.:contentReference[oaicite:18]{index=18},2314.2,2314.2,17,,"laundry,washer",Yes,10-WEST-WLX-1517.P,"Capacity: 15 kg  
Drum Material: Stainless steel (diamond drum)  
Wash Programs: Heavy, Normal, Delicate, Wool, Quick, Eco, Rinse & Spin, Spin, Tub Clean  
Control Panel: LED display with touch-sensitive buttons  
Motor Type: Inverter motor with built-in overload protection  ",104x65x67 cm,50 kg,Steel,White,3 Star (ESMA), 1.0 kWh per cycle (standard 40 °C wash)  ,15 kg,"Coverage Period: 3 months | What’s Covered: Complete electronic unit | Exclusions: Physical damage by consumer, unless otherwise specified",Yes,WLX-1517.P
,,,,,,,,,,,,,,,,,,,,,,
,,,,,,,,,,,,,,,,,,,,,,
,,,,,,,,,,,,,,,,,,,,,,
,,,,,,,,,,,,,,,,,,,,,,
,,,,,,,,,,,,,,,,,,,,,,
